NewYork-Presbyterian Weill Cornell Medical Center,"525 E 68th St, New York, NY 10065",link of image by file or by web address,4.8,12NYU Langone Medical Center,"550 1st Avenue, New York, NY 10016",blob,3.7,99NYC Health + Hospitals/Metropolitan,"1901 1st Avenue, New York, NY 10029",image,3.4,131Bellevue Hospital Center,"462 1st Avenue, New York, NY 10016",thing,3.5,314New York Presbyterian Hospital,"650 W 168th St, New York, NY 10032",whatever,3.3,33Mount Sinai Beth Israel,"10 Nathan D Perlman Pl, New York, NY 10003",logo,3.6,67